{
  "$schema": "./schemas/page-contracts.schema.json",
  "version": "0.1.0-alpha.3",
  "pages": [
    {
      "id": "overview",
      "path": "/",
      "navGroup": "监控",
      "label": "概览",
      "purpose": "确认系统状态、使用量与待处理问题",
      "primaryAction": null,
      "layout": "kpi-strip + onboarding + compact tables",
      "regions": [
        {
          "id": "workspace",
          "owner": "Overview queries and route composition",
          "states": [
            {
              "id": "loading",
              "availability": "required",
              "owner": "Overview queries",
              "entry": "首次进入且没有缓存",
              "preserves": ["Route"],
              "recovery": "查询完成后进入 ready、first-empty 或 error",
              "urlOutcome": "保持 /",
              "selectionOutcome": "无选择状态",
              "focusOutcome": "保持当前导航焦点",
              "scenarioIds": ["UX-OVERVIEW-LOADING"]
            },
            {
              "id": "ready-or-partial",
              "availability": "required",
              "owner": "Overview route composition",
              "entry": "至少一个概览区域成功加载",
              "preserves": ["成功区域", "起步向导上下文"],
              "recovery": "失败区域独立重试",
              "urlOutcome": "保持 /",
              "selectionOutcome": "无选择状态",
              "focusOutcome": "重试后返回触发按钮或更新区域",
              "scenarioIds": ["UX-OVERVIEW-READY"]
            },
            {
              "id": "first-empty",
              "availability": "required",
              "owner": "Overview onboarding projection",
              "entry": "尚未创建连接或客户端",
              "preserves": ["已存在对象"],
              "recovery": "导航到对应创建入口",
              "urlOutcome": "进入目标页面",
              "selectionOutcome": "不伪造默认对象",
              "focusOutcome": "目标页主标题或创建入口可达",
              "scenarioIds": ["UX-OVERVIEW-FIRST-EMPTY"]
            }
          ]
        }
      ]
    },
    {
      "id": "requests",
      "path": "/requests",
      "navGroup": "监控",
      "label": "请求",
      "purpose": "解释一次逻辑请求及其上游 Attempt 链",
      "primaryAction": "发送测试请求",
      "layout": "master-detail",
      "regions": [
        {
          "id": "request-list",
          "owner": "useRequests query",
          "states": [
            {
              "id": "loading",
              "availability": "required",
              "owner": "useRequests query",
              "entry": "首次进入且没有缓存",
              "preserves": ["requestId URL"],
              "recovery": "查询完成或显式重试",
              "urlOutcome": "保留 requestId",
              "selectionOutcome": "保留 URL 选择，不推断对象存在",
              "focusOutcome": "保持当前焦点",
              "scenarioIds": ["UX-REQUESTS-LIST-LOADING"]
            },
            {
              "id": "ready-empty-or-stale",
              "availability": "required",
              "owner": "Request list region",
              "entry": "列表查询成功、成功空或缓存刷新失败",
              "preserves": ["最后成功列表", "requestId URL"],
              "recovery": "局部重试且不清空 Inspector",
              "urlOutcome": "保留 requestId",
              "selectionOutcome": "有效选择保持高亮",
              "focusOutcome": "重试后返回列表区域",
              "scenarioIds": ["UX-REQUESTS-LIST-LIFECYCLE"]
            }
          ]
        },
        {
          "id": "request-inspector",
          "owner": "requestId URL and useRequest query",
          "states": [
            {
              "id": "unselected-loading-ready-or-error",
              "availability": "required",
              "owner": "requestId URL and Inspector query",
              "entry": "requestId 缺失、变化或详情查询结算",
              "preserves": ["请求列表", "最后成功详情的局部边界"],
              "recovery": "选择请求或局部重试",
              "urlOutcome": "选择写入 requestId",
              "selectionOutcome": "与 requestId 一致",
              "focusOutcome": "选择入口或 Inspector 恢复动作保持可达",
              "scenarioIds": ["UX-REQUESTS-INSPECTOR-LIFECYCLE"]
            }
          ]
        }
      ]
    },
    {
      "id": "analytics",
      "path": "/analytics",
      "navGroup": "监控",
      "label": "分析",
      "purpose": "比较使用量、稳定性、性能与成本",
      "primaryAction": "导出 CSV",
      "layout": "filters + metric switch + chart + breakdown",
      "regions": [
        {
          "id": "workspace",
          "owner": "Future Analytics route",
          "states": [
            { "id": "not-delivered", "availability": "n/a", "reason": "Analytics 尚未进入 Page Manifest 或当前 Web 路由。" }
          ]
        }
      ]
    },
    {
      "id": "connections",
      "path": "/connections",
      "navGroup": "配置",
      "label": "连接",
      "purpose": "管理 Provider、Endpoint、账号、Credential 与兼容性",
      "primaryAction": "添加连接",
      "layout": "provider-directory + durable-detail",
      "regions": [
        {
          "id": "connection-directory",
          "owner": "connectionId URL and useConnections query",
          "states": [
            {
              "id": "loading-ready-empty-error-or-stale",
              "availability": "required",
              "owner": "Connections directory",
              "entry": "列表查询开始或结算",
              "preserves": ["最后成功目录", "connectionId", "tab"],
              "recovery": "局部重试或创建连接",
              "urlOutcome": "有效 connectionId 与非默认 tab 可恢复",
              "selectionOutcome": "缺失或无效 ID 按连接页合同规范化",
              "focusOutcome": "目录操作或重试入口保持可达",
              "scenarioIds": ["UX-CONNECTIONS-DIRECTORY-LIFECYCLE"]
            }
          ]
        },
        {
          "id": "connection-detail",
          "owner": "Connections detail and server-backed Probe",
          "states": [
            {
              "id": "detail-and-probe",
              "availability": "required",
              "owner": "connectionId/tab URL and compatibility query",
              "entry": "选择连接、切换 Tab 或启动 Probe",
              "preserves": ["连接目录", "服务端 Probe 进度", "已成功模型事实"],
              "recovery": "关闭临时 Sheet、刷新或从兼容性 Tab 继续",
              "urlOutcome": "恢复 connectionId 与 tab",
              "selectionOutcome": "保持同一连接",
              "focusOutcome": "关闭临时任务后返回触发入口",
              "scenarioIds": ["UX-CONNECTIONS-DETAIL-PROBE"]
            }
          ]
        }
      ]
    },
    {
      "id": "models",
      "path": "/models",
      "navGroup": "配置",
      "label": "模型",
      "purpose": "管理 Endpoint 级模型绑定及当前可确认的元数据",
      "primaryAction": "添加模型绑定",
      "layout": "dense-table + persistent-inspector",
      "regions": [
        {
          "id": "model-directory",
          "owner": "useModelBindings query",
          "states": [
            {
              "id": "loading-ready-empty-error-or-stale",
              "availability": "required",
              "owner": "Models directory",
              "entry": "绑定查询开始或结算",
              "preserves": ["最后成功目录", "modelBindingId"],
              "recovery": "局部重试或添加绑定",
              "urlOutcome": "保留有效 modelBindingId",
              "selectionOutcome": "选中行与 URL 一致",
              "focusOutcome": "目录操作保持可达",
              "scenarioIds": ["UX-MODELS-DIRECTORY-LIFECYCLE"]
            }
          ]
        },
        {
          "id": "model-inspector",
          "owner": "modelBindingId URL",
          "states": [
            {
              "id": "unselected-ready-or-invalid",
              "availability": "required",
              "owner": "Models route and page",
              "entry": "modelBindingId 缺失、有效或在目录加载后无效",
              "preserves": ["模型目录", "创建 Dialog 状态边界"],
              "recovery": "选择、关闭或 replace 清除无效 ID",
              "urlOutcome": "有效 ID 可刷新恢复，无效 ID 被清除",
              "selectionOutcome": "不自动选择首项",
              "focusOutcome": "关闭后返回原查看详情按钮",
              "scenarioIds": ["UX-MODELS-INSPECTOR-LIFECYCLE"]
            }
          ]
        },
        {
          "id": "model-create-dialog",
          "owner": "ModelsPage local Dialog state",
          "states": [
            {
              "id": "closed-loading-form-or-error",
              "availability": "required",
              "owner": "Create Model Binding form",
              "entry": "用户打开创建任务并加载 Endpoint",
              "preserves": ["模型目录", "modelBindingId"],
              "recovery": "取消、重试或创建成功",
              "urlOutcome": "不写入临时表单状态",
              "selectionOutcome": "不改变 Inspector 选择",
              "focusOutcome": "关闭后返回添加模型绑定按钮",
              "scenarioIds": ["UX-MODELS-CREATE-DIALOG"]
            }
          ]
        }
      ]
    },
    {
      "id": "routes",
      "path": "/routes",
      "navGroup": "配置",
      "label": "路由",
      "purpose": "定义确定性同协议模型映射并解释选择",
      "primaryAction": "创建路由",
      "layout": "rules-table + explanation-panel",
      "regions": [
        {
          "id": "workspace",
          "owner": "Future Routes route",
          "states": [
            { "id": "not-delivered", "availability": "n/a", "reason": "Routes 尚未进入 Page Manifest 或当前 Web 路由。" }
          ]
        }
      ]
    },
    {
      "id": "route-editor",
      "path": "/routes/new",
      "navGroup": "配置",
      "label": "创建路由",
      "purpose": "配置、模拟、校验并发布路由",
      "primaryAction": "保存并发布",
      "layout": "form-sections + sticky-explanation",
      "regions": [
        {
          "id": "workspace",
          "owner": "Future Route Editor route",
          "states": [
            { "id": "not-delivered", "availability": "n/a", "reason": "Route Editor 尚未进入当前 Web 路由。" }
          ]
        }
      ]
    },
    {
      "id": "clients",
      "path": "/clients",
      "navGroup": "配置",
      "label": "客户端",
      "purpose": "管理 Harness 实例与 Gateway Key 生命周期",
      "primaryAction": "添加客户端",
      "layout": "dense-table + persistent-inspector",
      "regions": [
        {
          "id": "client-directory",
          "owner": "useGatewayClients query",
          "states": [
            {
              "id": "loading-ready-empty-error-or-stale",
              "availability": "required",
              "owner": "Clients directory",
              "entry": "客户端查询开始或结算",
              "preserves": ["最后成功目录", "clientId"],